{
  "$schema": "https://json-schema.org/draft/2020-12/schema",
  "$id": "https://github.com/m2e2labs/paper_engine_studio/engine/book.schema.json",
  "title": "book.json",
  "description": "Everything printed around your pages, the running order, and what a store needs to list the book. Point at this file from a book with \"$schema\": \"../../engine/book.schema.json\" and your editor will complete and check it as you type.",
  "type": "object",
  "required": ["title", "parts"],
  "additionalProperties": false,
  "properties": {
    "$schema": { "type": "string", "description": "Path to this schema, for your editor. The engine ignores it." },

    "title": { "type": "string", "minLength": 1, "description": "The book's title, as printed on the cover." },
    "subtitle": { "type": "string", "description": "One line under the title on the cover and the copyright page." },
    "author": { "type": "string", "description": "Printed on the cover, and the creator in the EPUB." },
    "series": { "type": "string", "description": "The label in every page's eyebrow. Defaults to the title." },
    "brand": { "type": "string", "description": "The left of every page's running foot. Usually your site." },
    "editionLabel": { "type": "string", "description": "Printed on the copyright page, and the start of a release folder's name. Example: Edition 1.0" },
    "unit": { "type": "string", "description": "What you call a page, plural, in printed copy. Default: blocks." },
    "unitSingular": { "type": "string", "description": "The singular of unit, if dropping the s is not enough." },
    "interior": { "type": "string", "pattern": "^[^/\\\\]+\\.html?$", "description": "The file holding your pages, if it is not <slug>.html. A file name, not a path." },

    "numbered": { "type": "boolean", "description": "Print No. 01, No. 02 in the eyebrow. Default: true." },
    "contents": { "type": "boolean", "description": "Generate a contents page. Default: true." },
    "index": { "type": "boolean", "description": "Generate an alphabetical index. Default: true." },
    "accent": { "$ref": "#/$defs/colour", "description": "The book's accent: the colour of the mechanism being taught, on every page and in every diagram. Default: #6366F1." },
    "accentStrong": { "$ref": "#/$defs/colour", "description": "The accent as text: highlighted words, small caps labels. Left out, it is worked out from accent." },
    "theme": {
      "type": "object", "additionalProperties": false,
      "description": "The rest of the book's colours. Pages are always written in the studio palette; build.mjs repaints the finished book, diagrams included. The roles never change, only what they look like.",
      "properties": {
        "signal": { "$ref": "#/$defs/colour", "description": "The good outcome. Default: #0D9488." },
        "danger": { "$ref": "#/$defs/colour", "description": "The threat or the mistake. Default: #DC2626." },
        "warn": { "$ref": "#/$defs/colour", "description": "The thing worth protecting. Default: #B45309." },
        "ink": { "$ref": "#/$defs/colour", "description": "Text. Default: #1A1A2E." },
        "muted": { "$ref": "#/$defs/colour", "description": "Quiet text: the subtitle, the eyebrow, the foot. Default: #5B6472." },
        "line": { "$ref": "#/$defs/colour", "description": "Rules and borders. Default: #E7E9EF." },
        "surface": { "$ref": "#/$defs/colour", "description": "The page. Default: #FAFAFC." },
        "card": { "$ref": "#/$defs/colour", "description": "The explainer card, and neutral cards in diagrams. Default: #FFFFFF." }
      }
    },

    "cover": {
      "type": "object", "additionalProperties": false,
      "properties": {
        "kicker": { "type": "string", "description": "Small caps line above the title." },
        "note": { "type": "string", "description": "A line at the foot of the cover." },
        "art": { "type": "string", "description": "Optional self-contained inline SVG markup for a small illustration on the cover, between the subtitle and the author line. No external references." }
      }
    },
    "copyright": {
      "type": "object", "additionalProperties": false,
      "properties": {
        "year": { "type": "integer", "minimum": 1900, "maximum": 2200 },
        "rights": { "type": "string", "description": "The rights line. Default: (c) <year> <author>. All rights reserved." },
        "lines": { "type": "array", "items": { "type": "string" }, "description": "Extra lines on the copyright page, above the rights line. Put your ISBN here: it is not printed for you." }
      }
    },

    "parts": {
      "type": "array", "minItems": 1,
      "description": "The running order. Every part gets a divider page.",
      "items": {
        "type": "object", "required": ["name", "blocks"], "additionalProperties": false,
        "properties": {
          "name": { "type": "string", "minLength": 1 },
          "eyebrow": { "type": "string", "description": "Small caps line on the divider." },
          "why": { "type": "string", "description": "One line telling the reader why these pages belong together." },
          "listLabel": { "type": "string", "description": "Heading over the divider's page list. Default: In this part." },
          "blocks": { "type": "array", "uniqueItems": true, "items": { "type": "string", "minLength": 1 }, "description": "Page titles, in reading order, exactly as in each page's <h1 class=\"title\">." }
        }
      }
    },
    "editions": {
      "type": "object",
      "description": "The same pages cut into different books. Each edition is the list of page titles it keeps.",
      "propertyNames": { "pattern": "^(?!(?:full|all)$)[a-z0-9][a-z0-9-]*$" },
      "additionalProperties": { "type": "array", "uniqueItems": true, "items": { "type": "string", "minLength": 1 } }
    },

    "matter": {
      "type": "object", "additionalProperties": false,
      "description": "The pages around your pages. front: a dedication and an epigraph go before the contents, everything else after it. back: before the index. Build with engine/tools/build.mjs.",
      "properties": {
        "front": { "type": "array", "items": { "$ref": "#/$defs/matterPage" } },
        "back": { "type": "array", "items": { "$ref": "#/$defs/matterPage" } }
      }
    },

    "research": {
      "type": "object", "additionalProperties": false,
      "properties": { "maxAgeDays": { "type": "integer", "minimum": 1, "maximum": 3650, "description": "A cited fact last checked longer ago than this is flagged by preflight. Default: 365. A book about software wants less." } }
    },

    "language": { "type": "string", "pattern": "^[a-z]{2,3}(-[A-Za-z0-9]{2,8})*$", "description": "BCP 47 language tag: en, en-GB, ar, fr-CA. Goes into the EPUB and tells a store what it is selling." },
    "identifier": { "type": "string", "pattern": "^urn:[a-z0-9][a-z0-9-]{0,31}:.+$", "description": "The EPUB's unique id, as a URN. Only needed if you have no EPUB ISBN and want your own id; otherwise one is derived from the book's folder and stays stable." },

    "publishing": {
      "type": "object", "additionalProperties": false,
      "description": "What a store listing asks for. None of it is printed in the book. It goes into the EPUB's metadata and into listing.md in every release.",
      "properties": {
        "description": { "type": "string", "maxLength": 4000, "description": "The blurb. Stores cap it at 4000 characters." },
        "keywords": { "type": "array", "maxItems": 7, "uniqueItems": true, "items": { "type": "string", "minLength": 1, "maxLength": 50 }, "description": "Search phrases. KDP takes seven." },
        "categories": { "type": "array", "uniqueItems": true, "items": { "type": "string", "minLength": 1 }, "description": "BISAC codes or the store's own category paths. Example: COM053000 or Computers / Security / General" },
        "publisher": { "type": "string", "description": "The imprint. Defaults to brand in the EPUB." },
        "published": { "type": "string", "pattern": "^$|^on release$|^\\d{4}-(0[1-9]|1[0-2])-(0[1-9]|[12]\\d|3[01])$", "description": "Publication date, YYYY-MM-DD, or \"on release\" when the store sets it the day the book goes live (KDP asks for a date only if the book was published before)." },
        "audience": { "type": "string", "description": "Who it is for, in a few words. For you and for the listing sheet." },
        "price": { "$ref": "#/$defs/price" },
        "isbn": { "$ref": "#/$defs/isbns" },
        "editions": {
          "type": "object",
          "description": "Anything that differs for one edition. Keys are edition names from \"editions\".",
          "additionalProperties": {
            "type": "object", "additionalProperties": false,
            "properties": {
              "title": { "type": "string", "description": "Listing title for this edition, if it is not \"<title> (<edition> edition)\"." },
              "description": { "type": "string", "maxLength": 4000 },
              "price": { "$ref": "#/$defs/price" },
              "isbn": { "$ref": "#/$defs/isbns" }
            }
          }
        }
      }
    }
  },

  "$defs": {
    "matterPage": {
      "type": "object", "required": ["kind"], "additionalProperties": false,
      "properties": {
        "kind": { "type": "string", "enum": ["dedication", "epigraph", "prose", "list", "sources", "glossary"], "description": "glossary: generated from GLOSSARY.md, nothing to write. dedication: a few centred lines. epigraph: a quotation. prose: a heading and paragraphs (preface, introduction, about the author). list: a heading and named items (also by, further reading). sources: generated from FACTS.md, nothing to write." },
        "title": { "type": "string", "description": "The heading, and the line in the contents. Needed for prose and list. Sources and glossary default to Sources and Glossary." },
        "body": { "type": "array", "items": { "type": "string" }, "description": "One string per paragraph (per line, for a dedication). **bold** and *italic* work. A paragraph starting with '## ' is a subheading. Long prose continues onto another sheet by itself." },
        "by": { "type": "string", "description": "Who said the epigraph, or the name a preface is signed with." },
        "items": {
          "type": "array", "description": "For kind list.",
          "items": {
            "type": "object", "required": ["name"], "additionalProperties": false,
            "properties": { "name": { "type": "string", "minLength": 1 }, "note": { "type": "string" } }
          }
        },
        "toc": { "type": "boolean", "description": "List it in the contents. Default: true, except a dedication and an epigraph." },
        "editions": { "type": "array", "uniqueItems": true, "items": { "type": "string", "minLength": 1 }, "description": "Only in these editions. full is the whole book. Leave out for every edition." }
      }
    },
    "colour": { "type": "string", "pattern": "^#([0-9A-Fa-f]{3}|[0-9A-Fa-f]{6})$" },
    "date": { "type": "string", "pattern": "^$|^\\d{4}-(0[1-9]|1[0-2])-(0[1-9]|[12]\\d|3[01])$" },
    "isbn": { "type": "string", "pattern": "^$|^(97[89])[- ]?(\\d[- ]?){9}\\d$", "description": "ISBN-13, hyphens optional. The check digit is verified by preflight." },
    "isbns": {
      "type": "object", "additionalProperties": false,
      "description": "One ISBN per format. A print book and its ebook may not share one.",
      "properties": { "print": { "$ref": "#/$defs/isbn" }, "epub": { "$ref": "#/$defs/isbn" }, "pdf": { "$ref": "#/$defs/isbn" } }
    },
    "price": {
      "type": "object", "required": ["amount", "currency"], "additionalProperties": false,
      "properties": {
        "amount": { "type": "number", "minimum": 0 },
        "currency": { "type": "string", "pattern": "^[A-Z]{3}$", "description": "ISO 4217: USD, EUR, GBP." }
      }
    }
  }
}
